Sheet: Species
A1: Species | B1: T | C1: A | D1: P | E1: E | F1: Class Options | G1: Power | H1: Power Description | I1: Description | J1: Role 1 | K1: Role 2 | L1: Signature | M1: Signature Description | N1: Quote | O1: Form | P1: Shape 1 | Q1: Shape 2 | R1: Species
A2: Cerpali | B2: 2 | C2: 2 | F2: Brawler, Commander, Investigator, Shaman, Trooper | G2: Body Control | H2: Cerpali are masters of their own bodies, and can exert themselves enough to crush walls or jump over cars. | I2: Cerpali are devoted veterans of an alien invasion against their homeworld that claimed billions of lives, but ended in a costly victory for these warriors. After the war ravaged their home, they now wander the stars with most of them finding jobs as soldiers or guards. | J2: Tank | K2: Piercer | L2: Topple Tyrants | M2: Modifies Melee Attack: Regardless of success, reduce one target's Offense by 1. | N2: "You will not stop us. Our home was overrun by hordes of Agkir aliens a generation ago, and do you know what happened? They lost. The Agkir are a threat no longer, because we do not relent." | O2: Natural | P2: Raccoon | Q2: Lobster | R2: Cerpali
A3: Eidolon | B3: 1 | C3: 1 | D3: 1 | E3: 1 | F3: Bulwark, Dervish, Occultist, Trickster, Worldweaver | G3: Elements | H3: Eidolons possess total mastery of one of the twelve principal elements, and their non-living shape has many resistances. | I3: Eidolons are intelligent masses of a single element, such as fire or darkness, and in legal and social terms are like intelligent Robots made out of magic. If a magician creates an Eidolon, it will inherit a youthful version of his personality, but Eidolons can also reproduce asexually. | J3: Blaster | K3: Drainer | L3: Absorption | M3: Reaction: After you are hit by a Magic Attack, you perform Recharge Self. | N3: "Whatcha talkin' about? I think Jake over there found somethin' good in the wreck, so he sent me to tell ya. That, and I guess he didn't want me meltin' it or somethin' huh..." | O3: Magical | P3: One Element | Q3: Spheres | R3: Eidolon
A4: Erezdo | B4: 3 | D4: 1 | F4: Brawler, Bulwark, Commander, Crusader, Guardian | G4: Force | H4: Erezdo can use telekinesis to quickly move saintstones, indestructible gems from the Celestial Realm. | I4: Erezdo hail from the Celestial Realm, sent here on a mission to prevent the invention of dimensional weapons. Though they succeeded, they soon got sidetracked in a lengthy battle over the base they claimed in Tassar territory, and their stubborn nature has not helped their cause. | J4: Tank | K4: Support | L4: Champion Strike | M4: Modifies Melee Attack: After your attack hits, you perform Inspire Group. | N4: "Surrender, and you can go home and be at peace. If you so foolishly fire upon an innocent Erezdo village... Consider yourselves warned." | O4: Celestial | P4: Lion | Q4: Knight | R4: Erezdo
A5: Glarosp | D5: 2 | E5: 2 | F5: Assassin, Investigator, Occultist, Thief, Trickster | G5: Hypnosis | H5: Glarosp are hypnotic, able to manipulate others through control and fear, and can make people ignore their presence. | I5: Glarosp are jealous, manipulative, and very good with poison. The technical term for their hypnotic abilities is lethetic or "anti-memetic," meaning they can cause facts to be treated as secrets, making people avoid thinking about certain things (like a sneaking Glarosp). | J5: Drainer | K5: Obstacle | L5: Nightmare | M5: Modifies Intimidate: After your action succeeds with at least 2 DoS, you perform Sneak. | N5: "You seem unsettled by my presence... There, there, have some milk. I laced it with a few hallucinogens; once you acclimate to those I won't seem nearly as scary." | O5: Natural | P5: Snake | Q5: Slug | R5: Glarosp
A6: Human | C6: 1 | D6: 1 | E6: 2 | F6: Advisor, Dervish, Noble, Pilot, Thief | G6: Mind Devices | H6: Humans can improve their bodies with cybernetics and minds with psychomatons, which are machines made of thoughts. | I6: Humans have a serious underdog complex stemming from the fact that all other major species seem to have innate, fantastical powers. But, Humans have a seemingly-limitless capacity for cybernetic and psychomatic (referring to thought-devices) augmentation, so they can catch up quite easily. | J6: Obstacle | K6: Support | L6: Fluid Thoughts | M6: Reaction: When you are targeted by a Talk Drain, raise your Offense by 1. | N6: "OK, so you think that being twice my height and regenerating makes you somehow better than me. Well, I just activated a device in my brain that will amplify gravity until you can't crawl." | O6: Natural | P6: Human | Q6: Cyborg | R6: Human
A7: Ilapa | C7: 1 | D7: 3 | F7: Noble, Occultist, Seer, Skirmisher, Trickster | G7: Telepathy | H7: Ilapa are telepathic broadcasters, unable to read minds but able to cause strong mental effects on lifeforms, robots, and more. | I7: Ilapa are from the Celestial Realm, and even though they are not pacifists, they come close. They are skilled social networkers, and can spread ideas and thoughts with abilities classified as "memetic," the opposite of Glarosp powers. | J7: Support | K7: Drainer | L7: Safe Command | M7: Modifies Inspire Group: Regardless of success, raise your Defense by 1. | N7: "Please, there doesn't need to be any bloodshed. We're in touch with several hiring agencies that could find you a more... hospitable employer than Mazok the Blood King." | O7: Celestial | P7: Llama | Q7: Rabbit | R7: Ilapa
A8: Kurguiv | C8: 3 | D8: 1 | F8: Crusader, Marksman, Skirmisher, Trooper, Wanderer | G8: Reaction | H8: Kurguiv have extremely good reflexes, bordering on being aware of the future just before it happens. | I8: Kurguiv believe holy war is glorious, and most are devoted to their God of Battle, Vrid, who appeared repeatedly on their homeworld to fight the Glarosp (natives to a moon of that world). Who Vrid is remains a mystery, but he seems to be a Celestial like the Erezdo. | J8: Blaster | K8: Tank | L8: Nimble Dodge | M8: Reaction: When you are targeted by a Ranged Attack, raise your Defense by 1. | N8: "KSSHK forgive the gas mask static, it's KSSHK acting up more than usual, but with KSSHK a known Glarosp assassin slithering around, you KSSHK can never be too careful against poison." | O8: Natural | P8: Bird Wings | Q8: Crab Legs | R8: Kurguiv
A9: Lomuk | C9: 2 | D9: 2 | F9: Brawler, Dervish, Scout, Shaman, Wanderer | G9: Geometry | H9: Lomuk can alter the distance between themselves and nearby areas, useful for sidestepping, levitating, or dashing. | I9: Lomuk hail from the Spirit Realm, and their biology seems bizarre to non-Spirits; their bodies are large, stretchy, hollow, and seemingly always hungry. They can't return home because of a terrible disease spreading in the Spirit Realm. Tassar find Lomuk very annoying, but Nodebpe love them. | J9: Piercer | K9: Obstacle | L9: Momentum | M9: Modifies Extra Move: You can perform a Melee Attack after your move. | N9: "WAS IN SAD PLACE. CAME HERE! BRING SPIRIT FRIENDS. WE FREE NOW. FOOD EASY. WE FRIEND! YOU HAVE FOOD?" | O9: Spirit | P9: Puppet | Q9: Starfish | R9: Lomuk
A10: Nodebpe | B10: 2 | D10: 2 | F10: Crusader, Seer, Shaman, Wanderer, Worldweaver | G10: Channeling | H10: Nodebpe can channel psychic energy from a limitless source to magnify their own physical strength and toughness. | I10: Nodebpe worship nature and the benevolent Elders of their species. Their psychic powers are linked to their oath with Nalan, the mysterious entity that governs mentalism, which has each Nodebpe swear to avoid directly using technology and in turn gain immense physical and mental power. | J10: Support | K10: Tank | L10: Favored Strike | M10: Modifies Melee Attack: After your attack hits, you perform Invigorate Group. | N10: "You must have respect for all things. The world is a beautiful web of interconnected hearts and minds, and ascending to a higher form can only be done by being mindful of others." | O10: Natural | P10: Bear | Q10: Centipede | R10: Nodebpe
A11: Pelmir | C11: 1 | D11: 2 | E11: 1 | F11: Assassin, Occultist, Seer, Thief, Worldweaver | G11: Plants | H11: Pelmir can cause natural plants and plant-like lifeforms to grow from their body in customized shapes and at great speed. | I11: Pelmir, natives to the now-diseased Spirit Realm, are rebellious and argumentative, but are smart enough to know when to hold their tongue. They are reluctant to enter combat when it isn't on their terms, and use their plant magic to weaken enemies with poisonous thorns or grasping vines. | J11: Drainer | K11: Blaster | L11: Trick Magic | M11: Modifies Outwit: After your action succeeds with at least 2 DoS, you perform a Magic Attack. | N11: "Everything is not okay. You need to wake up and smell the fire that's raging beneath the surface of your supposedly calm society." | O11: Spirit | P11: Hunchback | Q11: Orchid | R11: Pelmir
A12: Robot | B12: 2 | E12: 2 | F12: Bulwark, Guardian, Marksman, Mechanic, Trooper | G12: Computers | H12: Robots can specialize to be highly skilled at narrow tasks, and have the strength, toughness, and vulnerabilities of metal. | I12: Robots are constructed by about half of all species, and a tremendous amount of research goes into making better Robots every year; the majority of R&D focuses on improving the ability of Robots to cast spells. They tend to be given the rights of other sentient creatures by most governments. | J12: Tank | K12: Obstacle | L12: Cold Logic | M12: Reaction: When you are targeted by a Talk Drain, raise your Defense by 1. | N12: "I must seek repairs on my secondary processor, it reported some outstanding warrant data that seems clearly incongruous upon inspecting my footage of the events in question." | O12: Artificial | P12: Robot | Q12: Robot | R12: Robot
A13: Sfyst | B13: 1 | E13: 3 | F13: Commander, Investigator, Marksman, Pilot, Scout | G13: Senses | H13: Sfyst not only have extremely good senses, they can sense things like age, name, or creator as if using magic. | I13: Sfyst are gruff and businesslike; they distrust magic but have a deeply-ingrained curiosity about technology. Their sensory abilities are in high demand in many fields, and their ability to see distant planets with the naked eye led them to explore space earlier than any other species. | J13: Obstacle | K13: Blaster | L13: Watch And Learn | M13: Modifies Sense: After your action succeeds with at least 2 DoS, you perform Advise. | N13: "Aaron Jones is in this building, 3 floors up. He's been wounded (smells like it was a gunshot), and even though there's a psychomaton active in Aaron's brain, the mental device isn't his." | O13: Natural | P13: Elephant | Q13: Octopus | R13: Sfyst
A14: Tassar | C14: 1 | E14: 3 | F14: Advisor, Noble, Mechanic, Pilot, Seer | G14: Animation | H14: Tassar can make inanimate objects fail when they choose, like stopping someone's car or jamming an enemy's gun from a distance. | I14: Tassar are self-centered, power-hungry controllers with a keenly analytical mind. They seem to be closely linked to Eidolons in that a magical force animates their form, but Tassar consider their species superior to everyone else, and do not acknowledge any relation to other creatures. | J14: Drainer | K14: Support | L14: Cunning Leader | M14: Modifies Outwit Group: After your action succeeds with at least 1 DoS, you perform Recharge Group. | N14: "I don't think fighting you personally is worth more to me than what these mercenaries would charge to rip you limb from limb. So I'll choose the second option and help myself to your pitiful wealth." | O14: Magical | P14: Fabric | Q14: Ghost | R14: Tassar
A15: Uljir | B15: 1 | C15: 2 | E15: 1 | F15: Advisor, Assassin, Guardian, Scout, Skirmisher | G15: Resistance | H15: Uljir have no overt magic powers of their own, but are nimble, cunning, and highly resistant to enemy magic. | I15: Uljir are disturbing and poorly understood by other species, mainly because their homeworld wasn't on any maps before it was discovered by a crash-landed science vessel. There is a hierarchy to their species, and the highest-ranking ones seem to be plotting something. | J15: Tank | K15: Drainer | L15: Vortex | M15: Reaction: When you are targeted by a Magic Attack, reduce the attacker's Offense by 1. | N15: "We think you're trouble. This is good, we need trouble. In time, all will be revealed. For now, we have faith that the trouble you cause for the establishment is to our gain. We will aid. | O15: Mystery | P15: Thorns | Q15: Gorilla | R15: Uljir
A16: Vashk | B16: 3 | C16: 1 | F16: Brawler, Crusader, Guardian, Mechanic, Trooper | G16: Regeneration | H16: Vashk are very strong and can regenerate quickly as their bloodlust rises, making them combat powerhouses. | I16: Vashk come from a world where any usable materials for building are extremely rare, but their species is overpopulated. This gives them a bias toward the value of objects relative to the value of life, and they often overestimate how durable other species are. | J16: Piercer | K16: Tank | L16: Regeneration | M16: Modifies Melee Attack: After your attack hits, you perform Heal Self. | N16: "KILL BREAK MAIM GET MAIMED KEEP GOING I'll fix that car, so sorry about that KILL THOSE GUYS BREAK THEIR GUNS actually I could use that gun, but I'll fix it later KILL DESTROY..." | O16: Natural | P16: Dinosaur | Q16: Wolverine | R16: Vashk
B17: of:=SUM([.B2:.B16]) -> 15 | C17: of:=SUM([.C2:.C16]) -> 15 | D17: of:=SUM([.D2:.D16]) -> 15 | E17: of:=SUM([.E2:.E16]) -> 15

Sheet: Species Properties
A1: Species | B1: Body Weapons | C1: Move | D1: Amt. | E1: Jump | F1: Amt. | G1: Movement | H1: Sense Range | I1: Special Senses | J1: Constant Resistance | K1: Resistance | L1: Resistance | M1: Resistance | N1: Constant Weakness | O1: Weakness | P1: Weakness | Q1: Weakness | R1: Major Name | S1: Major Property | T1: Moderate Name | U1: Moderate Property | V1: Minor Name | W1: Minor Property
A2: Cerpali | B2: Claw x4, Slam | C2: Walk | D2: 6 | E2: Jump | F2: 6 | G2: Stable | H2: 11 | I2: Night Vision | K2: Kinetic | L2: Earth | O2: Water | P2: Space | R2: Vigilance | S2: Offense and Defense penalties enemies cause against this character are lessened by 1, to a minimum of 0. | T2: Guarded | U2: Enemies who attack this character from the front treat this character as having 4 higher Evasion. | V2: Resilient | W2: Persistent damage this character suffers is halved.
A3: Eidolon | B3: Slam | C3: Glide | D3: 6 | E3: Float | F3: 6 | G3: Glide, Float, Hover | H3: 7 | I3: Sense Eidolon, Sense Disruption | J3: Fixed | O3: Any | R3: Incarnation | S3: Gain {Element Affinity 2} to this character's Fixed Element. Damage or {Element Effect} this character receives with the same type as this character's Fixed Element is negated. | T3: Realignment | U3: All of this character's skills that have a single Primary Element change that Element to this character's Fixed Element. This character treats any enemy's Resistance to his Fixed Element as half normal. | V3: Perceptive | W3: Enemies gain no bonus for attacking this character from the side or back. This character still has a facing direction.
A4: Erezdo | B4: Slam x2 | C4: Walk | D4: 4 | E4: Float | F4: 6 | G4: Stable, Float | H4: 12 | I4: Sense Disruption, Sense Corruption, Keen Smell, Keen Hearing | K4: Fire | L4: Light | O4: Air | P4: Darkness | R4: Sacred Armor | S4: Defense penalties enemies cause against this character are lessened by 2, to a minimum of 0. | T4: Holy Power | U4: Gain 1 Offense. | V4: Deflection | W4: Enemies who attack this character with a Ranged Attack treat this character as having 2 higher Evasion.
A5: Glarosp | B5: Bite, Talons x2, Slam | C5: Walk | D5: 4 | E5: Jump | F5: 4 | G5: Stable | H5: 13 | I5: Night Vision, Surround Vision, Sense Data | J5: Darkness | O5: Cold | P5: Light | Q5: Electric | R5: Devious | S5: Offense and Defense penalties you cause against enemies are increased by 1. | T5: Hypnotic | U5: This character is always treated as an ally, regardless of whether he is or not, by effects caused by any character on all of that character's allies. | V5: Nimble | W5: Gain 1 Evasion.
A6: Human | B6: Slam | C6: Walk | D6: 5 | E6: Float | F6: 6 | G6: Float, Heavy | H6: 13 | I6: Day Vision, Focused Vision, Sense Data | J6: Kinetic | O6: Atomic | P6: Electric | Q6: Water | R6: Adaptability | S6: Offense and Defense bonuses this character receives are increased by 1. | T6: Machine Body | U6: Any ailments other than Malfunctioning or Jammed that affect this character end 1 round earlier, to a minimum of 0 rounds. If this character is given the Malfunctioning or Jammed ailments, he loses 1 Offense. | V6: Potency | W6: Your Surge is increased by 1.
A7: Ilapa | B7: Talons, Slam | C7: Walk | D7: 6 | E7: Jump | F7: 6 | H7: 11 | I7: Keen Hearing, Sense Corruption, Sense Data, Sense Psychics | J7: Light | O7: Darkness | P7: Air | Q7: Earth | R7: Generosity | S7: Offense and Defense bonuses you grant to allies are increased by 1. | T7: Popularity | U7: Any Talk Drain that targets this character suffers a 25% failure chance (the failure chance doesn't affect any other targets). | V7: Purity | W7: Enemies who attack this character with a Magic Attack treat this character as having 1 higher Defense.
A8: Kurguiv | B8: Bite, Slam | C8: Glide | D8: 7 | E8: Float | F8: 6 | G8: Glide, Float | H8: 9 | I8: Day Vision | J8: Air | O8: Cold | P8: Atomic | Q8: Kinetic | R8: Take Charge | S8: Offense penalties enemies cause against this character are lessened by 2, to a minimum of 0. | T8: Flier | U8: This character is never harmed by Traps, and never suffers falling damage. Enemies who attack this character with a Melee Attack treat this character as having 2 higher Evasion. | V8: Nimble | W8: Gain 1 Evasion.
A9: Lomuk | B9: Bite, Slam x2 | C9: Glide | D9: 6 | E9: Jump | F9: 6 | G9: Glide, Hover | H9: 8 | I9: Surround Vision | J9: Space | O9: Time | P9: Water | Q9: Cold | R9: Oblivious | S9: Any Talk Drain that targets this character suffers a 75% failure chance (the failure chance doesn't affect any other targets). Offense and Defense bonuses this character receives are lessened by 1, to a minimum of 0. | T9: Spatial Twist | U9: Enemies who attack this character with a Ranged Attack treat this character as having 4 higher Evasion. | V9: Perceptive | W9: Enemies gain no bonus for attacking this character from the side or back. This character still has a facing direction.
A10: Nodebpe | B10: Bite, Slam | C10: Walk | D10: 5 | E10: Jump | F10: 2 | G10: Stable, Heavy, Wild | H10: 11 | I10: Day Vision, Focused Vision, Sense Psychics | K10: Air | L10: Electric | O10: Time | P10: Earth | R10: Serenity | S10: Persistent damage this character suffers is halved. Any Talk Drain that targets this character suffers a 25% failure chance (the failure chance doesn't affect any other targets). | T10: Behemoth | U10: This character takes up 2x2 squares, and any skills he uses originate in each of his squares, ignoring overlapping areas. Area skills that affect more than one of this chararacter's squares cause their effect once per square. | V10: Potency | W10: Your Surge is increased by 1.
A11: Pelmir | B11: Slam | C11: Walk | D11: 4 | E11: Jump | F11: 4 | G11: Wild | H11: 14 | I11: Keen Smell, Sense Corruption, Sense Disruption, Night Vision, Surround Vision | K11: Atomic | L11: Space | M11: Water | N11: Fire | R11: Naturalist | S11: This character is never harmed by Traps, and after this character is harmed by a Zone an enemy created, the Zone is automatically dismissed. | T11: Archmage | U11: Your Surge is increased by 2. | V11: Purity | W11: Enemies who attack this character with a Magic Attack treat this character as having 1 higher Defense.
A12: Robot | B12: Slam | C12: Walk | D12: 5 | E12: Jump | F12: 6 | G12: Heavy | H12: 13 | I12: Night Vision, Day Vision, Focused Vision, Keen Hearing | K12: Kinetic | L12: Time | M12: Cold | N12: Electric | R12: Memory | S12: Any boons that affect this character end 1 round later. | T12: Machine Body | U12: Any ailments other than Malfunctioning or Jammed that affect this character end 1 round earlier, to a minimum of 0 rounds. If this character is given the Malfunctioning or Jammed ailments, he loses 1 Offense. | V12: Resilient | W12: Persistent damage this character suffers is halved.
A13: Sfyst | B13: Slam | C13: Walk | D13: 3 | E13: Jump | F13: 2 | G13: Swim | H13: 15 | I13: Night Vision, Day Vision, Surround Vision, Keen Smell, Keen Hearing, Sense Data | K13: Earth | L13: Water | O13: Space | P13: Kinetic | R13: Sixth Sense | S13: Enemies who attack this character with a Ranged Attack treat this character as having 3 higher Defense. | T13: Thick Skin | U13: Gain 1 Defense. | V13: Perceptive | W13: Enemies gain no bonus for attacking this character from the side or back. This character still has a facing direction.
A14: Tassar | B14: Slam | C14: Glide | D14: 4 | E14: Float | F14: 6 | G14: Glide, Float | H14: 11 | I14: Sense Disruption, Surround Vision, Night Vision, Keen Hearing | K14: Time | L14: Cold | O14: Fire | P14: Kinetic | R14: Confidence | S14: Your Surge is increased by 1. Any Talk Drain that targets this character suffers a 25% failure chance (the failure chance doesn't affect any other targets). | T14: Flier | U14: This character is never harmed by Traps, and never suffers falling damage. Enemies who attack this character with a Melee Attack treat this character as having 2 higher Evasion. | V14: Perceptive | W14: Enemies gain no bonus for attacking this character from the side or back. This character still has a facing direction.
A15: Uljir | B15: Slam x2 | C15: Walk | D15: 6 | E15: Jump | F15: 6 | G15: Stable, Heavy | H15: 10 | I15: Night Vision, Focused Vision, Sense Disruption | K15: Darkness | L15: Atomic | O15: Space | P15: Light | R15: Void Soul | S15: Enemies who attack this character with a Magic Attack treat this character as having 3 higher Defense. | T15: Guarded | U15: Enemies who attack this character from the front treat this character as having 4 higher Evasion. | V15: Ferocity | W15: Enemies who attack this character with a Melee Attack treat this character as having 1 higher Defense.
A16: Vashk | B16: Bite, Talons, Claws x2, Slam | C16: Walk | D16: 5 | E16: Jump | F16: 6 | G16: Stable, Heavy | H16: 8 | I16: Keen Smell | K16: Electric | L16: Fire | O16: Atomic | P16: Time | R16: Fortitude | S16: Any ailments that affect this character end 1 round earlier, to a minimum of 0 rounds. | T16: Behemoth | U16: This character takes up 2x2 squares, and any skills he uses originate in each of his squares, ignoring overlapping areas. Area skills that affect more than one of this chararacter's squares cause their effect once per square. | V16: Ferocity | W16: Enemies who attack this character with a Melee Attack treat this character as having 1 higher Defense.
M22: Air | P22: Air
M23: Air | P23: Air
M24: Atomic | P24: Atomic
M25: Atomic | P25: Atomic
M26: Cold | P26: Atomic
M27: Cold | P27: Cold
M28: Darkness | P28: Cold
M29: Darkness | P29: Cold
M30: Earth | P30: Darkness
M31: Earth | P31: Darkness
M32: Electric | P32: Earth
M33: Electric | P33: Earth
M34: Fire | P34: Electric
M35: Fire | P35: Electric
M36: Kinetic | P36: Fire
M37: Kinetic | P37: Kinetic
M38: Kinetic | P38: Kinetic
M39: Light | P39: Kinetic
M40: Light | P40: Light
M41: Space | P41: Light
M42: Space | P42: Space
M43: Time | P43: Space
M44: Time | P44: Space
M45: Water | P45: Time
M46: Water | P46: Time
P47: Time
P48: Water
P49: Water
P50: Water

Sheet: Classes
A1: Class | B1: T | C1: A | D1: P | E1: E | F1: Description | G1: Role 1 | H1: Role 2 | I1: Signature | J1: Signature Description
A2: Advisor | B2: 0 | C2: 0 | D2: 2 | E2: 2 | F2: A shadowy "power behind the throne" who can increase one ally's stats tremendously and make enemies mistrust each other. | G2: Support | H2: Obstacle | I2: Play Favorites | J2: Modifies Advise: Success grants Offense bonus to the target equal to Defense granted. | L2: Tassar | M2: Human | N2: Uljir
A3: Agent | B3: 1 | C3: 1 | D3: 1 | E3: 1 | F3: Given awesome powers by Origin; can change the limit on the amount of damage/effect someone can cause (or receive). | G3: Drainer | H3: Piercer | I3: Authority | J3: Reaction: When an enemy is defeated, you perform Intimidate Group.
A4: Assassin | B4: 1 | C4: 2 | D4: 1 | E4: 0 | F4: A ruthless killer who is able to turn enemies around, deal extra damage attacking from behind, and use poison. | G4: Piercer | H4: Drainer | I4: Vanish | J4: Reaction: When an enemy is defeated, you perform Sneak. | L4: Glarosp | M4: Uljir | N4: Eidolon
A5: Brawler | B5: 3 | C5: 1 | D5: 0 | E5: 0 | F5: Close range fighter who doesn't have to use weapons to be effective; can perform combos to attack multiple times. | G5: Piercer | H5: Tank | I5: Beatdown | J5: Modifies Melee Attack: Regardless of success, reduce one target's Defense by 1. | L5: Vashk | M5: Uljir | N5: Erezdo | O5: Cerpalli
A6: Bulwark | B6: 3 | C6: 0 | D6: 0 | E6: 1 | F6: Magical guard with an energy shield that can form a barrier across the battlefield, or can absorb magic attacks. | G6: Obstacle | H6: Tank | I6: Ward | J6: Reaction: When you are targeted by a Magic Attack, raise your Defense by 1. | L6: Eidolon | M6: Erezdo | N6: Ilapa
A7: Commander | B7: 1 | C7: 0 | D7: 2 | E7: 1 | F7: A battlefield leader who grants allies extra actions and increases their targeting range. | G7: Support | H7: Blaster | I7: Glorious Leader | J7: Modifies Inspire Group: Offense bonus granted is doubled. | L7: Tassar | M7: Erezdo | N7: Cerpalli
A8: Crusader | B8: 3 | C8: 0 | D8: 1 | E8: 0 | F8: A faithful warrior who heals allies' HP by attacking enemies and has abilities to help get into melee combat. | G8: Tank | H8: Support | I8: Shining Strike | J8: Modifies Melee Attack: If your attack hits, you perform Heal Group. | L8: Erezdo | M8: Kurguiv | N8: Nodebpe | O8: Vashk
A9: Dervish | B9: 0 | C9: 3 | D9: 1 | E9: 0 | F9: A fast, daring magician-duelist who can cast spells when a physical attack hits or make weapon attacks on an area. | G9: Blaster | H9: Piercer | I9: Arcane Flash | J9: Modifies Melee Attack: If your attack hits, you perform a Magic Attack. | L9: Eidolon | M9: Human | N9: Lomuk
A10: Guardian | B10: 2 | C10: 1 | D10: 1 | E10: 0 | F10: A bulky protector trained to react quickly, who can preempt enemy attacks on allies or raise his own stats. | G10: Tank | H10: Obstacle | I10: Meat Shield | J10: Reaction: When an adjacent ally is targeted by any Attack, raise the ally's Defense by 1. | L10: Robot | M10: Uljir | N10: Erezdo | O10: Vashk
A11: Investigator | B11: 0 | C11: 0 | D11: 1 | E11: 3 | F11: A detective who gets much stronger the more he studies an enemy; can grant extra SP to allies who attack his studied foe. | G11: Drainer | H11: Support | I11: Evaluate | J11: Modifies Outwit: Defense penalty caused is doubled. | L11: Sfyst | M11: Glarosp | N11: Cerpalli
A12: Marksman | B12: 0 | C12: 3 | D12: 0 | E12: 1 | F12: Long range weapon user, can employ different elemental ammo and target different body parts. | G12: Piercer | H12: Blaster | I12: Take Aim | J12: Modifies Ranged Attack: Regardless of success, reduce one target's Defense by 1. | L12: Sfyst | M12: Robot | N12: Kurguiv
A13: Mechanic | B13: 1 | C13: 0 | D13: 0 | E13: 3 | F13: Creates drones of many sorts that can serve as weapons or as protection, and can turn broken drones into cover. | G13: Tank | H13: Obstacle | I13: Drone Guards | J13: Modifies Advise Group: Defense bonus granted is doubled. | L13: Tassar | M13: Vashk | N13: Robot
A14: Noble | B14: 0 | C14: 0 | D14: 3 | E14: 1 | F14: Political leader who restores allies' SP with his inspiring words and can discourage enemies from fighting. | G14: Support | H14: Drainer | I14: Rousing Speech | J14: Modifies Inspire Group: After your action succeeds with at least 1 DoS, you perform Recharge Group. | L14: Ilapa | M14: Human | N14: Sfyst
A15: Occultist | B15: 1 | C15: 0 | D15: 3 | E15: 0 | F15: Aggressive magician who takes damage when his spells are resisted, and gains power in the process. | G15: Blaster | H15: Piercer | I15: Fear As Fuel | J15: Modifies Intimidate Group: After your action succeeds with at least 1 DoS, you perform Recharge Self. | L15: Pelmir | M15: Ilapa | N15: Glarosp | O15: Eidolon
A16: Pilot | B16: 0 | C16: 2 | D16: 0 | E16: 2 | F16: Remote-controls his armed starship to send supplies or fire on enemy positions, with bad aim but great power. | G16: Blaster | H16: Support | I16: Outmaneuver | J16: Modifies Outwit Group: Success causes Offense penalty to all targets equal to Defense penalty caused. | L16: Sfyst | M16: Tassar | N16: Human
A17: Scout | B17: 2 | C17: 1 | D17: 0 | E17: 1 | F17: Mobile tracker and trapper who can avoid, create, and link hazards on the battlefield. | G17: Obstacle | H17: Drainer | I17: Quarry | J17: Modifies Ranged Attack: If your attack hits, you perform Outwit. | L17: Lomuk | M17: Uljir | N17: Sfyst
A18: Seer | B18: 0 | C18: 1 | D18: 0 | E18: 3 | F18: Can research on-the-fly using magic and science, outfox foes with eerie knowledge, and negate ambushes. | G18: Drainer | H18: Support | I18: See Weakness | J18: Modifies Sense: Regardless of success, reduce one target's Defense by 1. | L18: Ilapa | M18: Tassar | N18: Pelmir | O18: Nodebpe
A19: Shaman | B19: 2 | C19: 0 | D19: 2 | E19: 0 | F19: A keeper of the primal faith who slowly recovers allies' SP and HP over a battle, while issuing curses against enemies. | G19: Support | H19: Drainer | I19: Siphon Fortune | J19: Modifies Magic Attack: If your action succeeds, you perform Invigorate Group. | L19: Nodebpe | M19: Lomuk | N19: Cerpalli
A20: Skirmisher | B20: 1 | C20: 3 | D20: 0 | E20: 0 | F20: A lightning-fast warrior who can negate his targets' reactions and move as part of a series of attacks. | G20: Piercer | H20: Blaster | I20: Strafe | J20: Modifies Ranged Attack: After attacking, you move up to your speed. | L20: Kurguiv | M20: Lomuk | N20: Robot
A21: Thief | B21: 0 | C21: 2 | D21: 2 | E21: 0 | F21: A foolhardy, nimble rogue who can avoid notice, dodge attacks, or suddenly attract enemy attention with taunts. | G21: Tank | H21: Piercer | I21: Attract Blame | J21: Modifies Sneak: Regardless of success, raise one ally's Defense by 1. | L21: Human | M21: Glarosp | N21: Pelmir
A22: Trickster | B22: 0 | C22: 1 | D22: 3 | E22: 0 | F22: A bold liar who redirects enemy attacks, shortens enemy targeting range, and disrupts enemies' aid to each other with boons. | G22: Drainer | H22: Obstacle | I22: Guilt Trip | J22: Reaction: After you are hit by any Attack, reduce the attacker's Offense by 1. | L22: Pelmir | M22: Ilapa | N22: Glarosp
A23: Trooper | B23: 2 | C23: 0 | D23: 0 | E23: 2 | F23: Seasoned soldier who uses military weapons with huge areas of effect, and can weaken enemy fighters with a hail of gunfire. | G23: Blaster | H23: Tank | I23: Pin Down | J23: Modifies Ranged Attack: Regardless of success, reduce one target's Offense by 1. | L23: Cerpalli | M23: Vashk | N23: Robot | O23: Kurguiv
A24: Wanderer | B24: 0 | C24: 2 | D24: 1 | E24: 1 | F24: A mobile, evasive magician who gains power with every step; can force opponents to move where he wants. | G24: Obstacle | H24: Tank | I24: Worldly Power | J24: Modifies Extra Move: You perform Recharge on yourself after your move. | L24: Lomuk | M24: Nodebpe | N24: Kurguiv
A25: Worldweaver | B25: 1 | C25: 1 | D25: 0 | E25: 2 | F25: A wise wizard who creates zones on the battlefield that have effects on elements, ailments, or just battle stats. | G25: Obstacle | H25: Blaster | I25: Tactical Shift | J25: Modifies Advise: After your action, you move up to your speed. | L25: Eidolon | M25: Nodebpe | N25: Pelmir
B26: of:=SUM([.B2:.B25]) -> 24 | C26: of:=SUM([.C2:.C25]) -> 24 | D26: of:=SUM([.D2:.D25]) -> 24 | E26: of:=SUM([.E2:.E25]) -> 24
A27: Elements: | B27: Category | F27: Toughness: Reduces physical damage you take (Soak Value) and increases physical damage you deal. Raises max HP. | I27: Abbreviations | J27: DoS: Degrees of Success, HP: Hit Points, SP: Skill Points.
A28: Air | B28: Shaman | F28: Agility: Reduces accuracy of physical attacks against you and increases accuracy of your physical attacks. Raises max HP. | H28: Core | I28: Advise | J28: One ally gains 1 Defense plus 1 Defense per 2 DoS based on Expertise.
A29: Atomic | B29: Dervish | F29: Persona: Reduces magical damage you take (Barrier value) and increases magical damage you deal. Raises Surge. | H29: Core | I29: Inspire | J29: One ally gains 1 Offense plus 1 Offense per 2 DoS based on Persona.
A30: Cold | B30: Occult | F30: Expertise: Reduces accuracy of magical attacks against you and increases accuracy of your magical attacks. Raises Surge. | H30: Core | I30: Outwit | J30: One enemy loses 1 Defense plus 1 Defense per 2 DoS based on Expertise.
A31: Darkness | B31: Occult | F31: Actions: A character can move and perform a standard action on his turn, in that order. Standard actions can be skills... | H31: Core | I31: Intimidate | J31: One enemy loses 1 Offense plus 1 Offense per 2 DoS based on Persona.
A32: Earth | B32: Shaman | F32: ...from their classes or species, basic attacks from their weapon, core powers like Inspire or Sneak, or extra movement. | H32: Core | I32: Sneak | J32: Gain 1 Stealth plus 1 Stealth per 2 DoS based on the sum of Agility and Persona.
A33: Electric | B33: Dervish | F33: Reactions: Immediate, interrupting powers that occur at most once per turn if an event happens. | H33: Core | I33: Sense | J33: Reduce the Stealth of all enemies within your species' Sense Range by your DoS based on Expertise.
A34: Fire | B34: Dervish | F34: Modifiers: Powers that affect one action type. They become available on half the turns a character has, randomly chosen. | H34: Core | I34: Extra Move | J34: Give up your standard action to move up to your speed again.
A35: Kinetic | B35: Dervish | F35: Offense/Defense: A multiplier applied to how much damage you deal. If the attacker's Offense is greater than the target's... | I35: Heal | J35: Restore a target's HP by 30% (12% all) of max.
A36: Light | B36: Shaman | F36: ...Defense, the multiplier increases exponentially: 1.1, 1.2, 1.4, 1.8, 2.6, etc. If the target's Defense is greater... | I36: Recharge | J36: Restore a target's SP by 100% (40% all) of his Surge.
A37: Space | B37: Occult | F37: ...than the attacker's Offense, the multiplier decreases linearly: 0.9, 0.8, 0.7, 0.6, etc. Minimum of 0, no max. | I37: Invigorate | J37: Restore a target's HP by 15% (6% all) of his Max HP, and his SP by 50% (20% all) of his Surge.
A38: Time | B38: Occult | F38: Stealth: Non-area, non-group attacks and drains targeting you have a 10% miss chance per 1 Stealth. Using your standard... | H38: Core | I38: <Action> Group | J38: Perform <Action> on all enemies or allies. DoS are harder to get, needing 250% of the normal score.
A39: Water | B39: Shaman | F39: ...action sets your Stealth to 0. Minimum of 0, max of 8. | H39: Core | I39: <Action> Self | J39: Perform <Action> on yourself only.
A40: Continuum | B40: (Not Primary) | F40: Surge: Each round, a character gains a random amount of SP between 0 and his Surge. Surge is based on Persona and Expertise.
F42: Blaster: Deals multi-target damage, but usually needs help maintaining attacks every round.
F43: Drainer: Reduces an enemy's effectiveness without primarily doing damage.
F44: Obstacle: Prevents enemy strategies from working as planned by changing the battlefield.
F45: Piercer: Deals single-target damage, often with ways to get around defenses.
F46: Support: Provides bonuses to allies, often in the form of regaining limited resources.
F47: Tank: Forces enemies to attack him and his strong defenses instead of weaker allies.

Sheet: Class Details
A1: Class | B1: Skill 1 | C1: Description 1 | D1: Element 1 | E1: Class | F1: Trait 2 | G1: Class | H1: Skill 3 | I1: Description 3 | J1: Element 3 | K1: Class | L1: Trait 2 | M1: Class | N1: Skill 5 | O1: Description 5 | P1: Element 5
A2: Advisor | B2: My Lord | C2: Talk Boost, 1 SP: Designate one ally as your Master. Evasion, Offense and Defense bonuses you grant to your Master are increased by 1. The Master boon lasts for the encounter or until you use My Lord again. | D2: None | E2: Advisor | F2: Wisdom | G2: Advisor | H2: Sow Discord | I2: Talk Drain, 5 SP: Designate one enemy as your Puppet. Your Puppet has a 50% failure chance on any Talk Boost he attempts. The Puppet ailment lasts 3 rounds. | J2: None | K2: Advisor | L2: Nefarious | M2: Advisor | N2: Master Plan | O2: Talk Boost, 7 SP: You must have a Master to use this power. Your Master gains 2 Offense, 2 Defense, 2 Evasion, and 2 SP. | P2: None
A3: Agent | B3: Lockdown | C3: Magic Drain, 3 SP: Range 5. One enemy has his effect cap changed to 9. This replaces any other effect cap changes. This ailment lasts 2 rounds. | D3: Continuum | E3: Agent | F3: Energized | G3: Agent | H3: Agent Guard | I3: Magic Boost, 5 SP: One ally has the effect cap for all attacks that target him reduced to 9, unless the the attacker already has an effect cap change. This boon lasts 3 rounds. | J3: Continuum | K3: Agent | M3: Agent | N3: Breaking Point | O3: Melee Attack, 12 SP: Make a basic Melee attack against one target. The target has the effect cap for attacks that target him changed to 999 and takes 200% damage on a hit; does no damage on a miss. This replaces any other effect cap changes. This ailment lasts 2 rounds. | P3: Continuum
A4: Assassin | B4: Backstab | C4: Melee Attack, 1 SP: Make a basic Melee Attack against one target. Does 150% damage if you attacked your target from behind, or normal damage otherwise, on a hit; does no damage on a miss. | D4: Darkness | E4: Assassin | F4: Ambusher | G4: Assassin | H4: Stranglehold | I4: Melee Attack, 3 SP: Make a basic Melee attack against one target. Rotates the target to face away from you, does normal damage, and the target loses 1 Defense on a hit; does no damage on a miss. | J4: Kinetic | K4: Assassin | L4: Violence | M4: Assassin | N4: Poison Needle | O4: Ranged Attack, 5 SP: Range 5, does not use a Weapon. Does 175% damage (persistent) and the target loses 1 Defense and 2 SP on a hit; does no damage on a miss. | P4: Water | R4: Air | T4: Air | U4: Shaman
A5: Brawler | B5: Combo | C5: Melee Attack, 1 SP: Make a basic Melee Attack against one target. Does normal damage, the cost of Combo doubles this turn, and you use Combo again (if you have enough SP and there is a viable enemy target) on a hit; does no damage on a miss. | D5: Weapon | E5: Brawler | F5: Brute | G5: Brawler | H5: Heavy Hitter | I5: Melee Attack, 3 SP: Make a basic Melee attack against one target. Does 225% damage and you lose 1 Defense on a hit; does no damage on a miss. | J5: Weapon | K5: Brawler | L5: Parry | M5: Brawler | N5: Dazing Smash | O5: Melee Attack, 5 SP: Make a basic Melee attack against one target. Does 150% damage and the target loses 6 SP on a hit; does no damage on a miss. | P5: Weapon | R5: Atomic | T5: Atomic | U5: Dervish
A6: Bulwark | B6: Radiation Field | C6: Zone Hazard, 2 SP: You create a visible Blockade zone extending 5 squares away from your left and right sides. Enemies who enter the zone from outside suffer a basic Magic Attack. The Blockade lasts until you move. | D6: Atomic | E6: Bulwark | F6: Warded | G6: Bulwark | H6: Barrier Beam | I6: Magic Attack, 5 SP: You must have a Blockade to use this power. Your Blockade is dismissed and you make a Magic Attack, Line Area 10. Does 150% damage on a hit; does 50% damage on a miss. | J6: Atomic | K6: Bulwark | L6: Conservation | M6: Bulwark | N6: Arcane Nucleus | O6: Self Boost, 7 SP: You gain Atomic Affinity 5, gain 2 Defense, and end any persistent damage affecting you. | P6: Atomic | R6: Cold | T6: Cold | U6: Occult
A7: Commander | B7: Assault Tactics | C7: Talk Boost, 1 SP: Designate one ally to make a basic Melee Attack against a target of his choice. If the attack hits, the ally gains 1 Offense. | D7: None | E7: Commander | F7: Helpful | G7: Commander | H7: Open Fire | I7: Talk Boost, 3 SP: Designate one ally to make a basic Ranged Attack against a target of his choice. If the attack hits, the ally gains 2 Offense. | J7: None | K7: Commander | L7: Leadership | M7: Commander | N7: In Our Sights | O7: Talk Boost, 6 SP: All allies gain 2 Offense and the Hawkeye boon; this boon doubles their ranged weapons' ranges, and all skills they know with a specified range greater than 1 double that range. The Hawkeye boon lasts 3 rounds. | P7: None | R7: Earth | T7: Darkness | U7: Occult
A8: Crusader | B8: Glorious Blow | C8: Melee Attack, 2 SP: Make a basic Melee Attack against one target. Does 75% damage and you plus all allies within 3 squares gain 1 Offense on a hit; does no damage on a miss. | D8: Light | E8: Crusader | F8: Devotion | G8: Crusader | H8: Martyr | I8: Self Boost, 3 SP: You gain 2 Defense. You are visibly Preparing for 1 round. If you lose no more than a quarter of your current HP by your next turn, all enemies lose 1 Offense. | J8: Light | K8: Crusader | L8: Resist | M8: Crusader | N8: Divine Glory | O8: Self Boost, 4 SP: You gain 1 Defense, recover 30% of your max HP, and end any persistent damage affecting you. | P8: Light | R8: Electric | T8: Earth | U8: Shaman
A9: Dervish | B9: Dervish Magic | C9: Magic Attack, 2 SP: Range 5, Burst Area 2. Accuracy is based on Agility instead of Expertise. Does normal damage and causes {Element Effect 1} on a hit; does no damage on a miss. | D9: Dervish List | E9: Dervish | F9: Finesse | G9: Dervish | H9: Arcane Strike | I9: Melee Attack, 5 SP: Make a basic Melee Attack against all adjacent targets. Does 125% damage and causes {Element Effect 2} on a hit; causes {Element Effect 1} on a miss. | J9: Dervish List | K9: Dervish | L9: Wrath | M9: Dervish | N9: Temporal Blast | O9: Magic Attack, 7 SP: Range 10, Burst Area 3. Accuracy is based on Agility instead of Expertise. Does normal damage and the target is Immobilized for 2 rounds on a hit; does 50% damage on a miss. | P9: Time | R9: Kinetic | T9: Electric | U9: Dervish
A10: Guardian | B10: Get Back | C10: Melee Attack, 2 SP: Make a basic Melee Attack against one target. Does 75% damage, you push the target 2 squares, and the target loses 1 Offense on a hit; does no damage on a miss. | D10: Cold | E10: Guardian | F10: Brawn | G10: Guardian | H10: Crushing Pin | I10: Melee Attack, 3 SP: Make a basic Melee attack against one target. Does normal damage, causes the Prone condition, and reduces the target's Offense by 1 on a hit; does no damage on a miss. | J10: Earth | K10: Guardian | L10: Alertness | M10: Guardian | N10: Icy Stare | O10: Ranged Drain, 5 SP: One enemy loses 3 Offense and 3 SP. | P10: Cold | R10: Light | T10: Fire | U10: Dervish
A11: Investigator | B11: Study | C11: Ranged Drain, 2 SP: Range 10. Designate one enemy as your Suspect. Reduce your Suspect's Defense by 1. Raise your Offense by 1 and Defense by 1. The Suspect ailment lasts for the encounter. | D11: None | E11: Investigator | F11: Alertness | G11: Investigator | H11: Lookout | I11: Talk Drain, 3 SP: You must have at least one Suspect to use this power. All enemies who are your Suspect lose 2 Offense and 3 SP. | J11: Cold | K11: Investigator | L11: Analysis | M11: Investigator | N11: No Escape | O11: Ranged Drain, 7 SP: Range 10. You must have at least one Suspect to use this power. Designate each of your Suspects as a Fugitive. When one of your allies hits a Fugitive with any attack, the ally gains 2 SP. The Fugitive ailment lasts for 2 rounds. | P11: None | R11: Space | T11: Kinetic | U11: Dervish
A12: Marksman | B12: Long Shot | C12: Ranged Attack, 2 SP: Make a basic Ranged Attack against one target. Double your weapon's range for this attack. Does 125% damage on a hit; does no damage on a miss. | D12: Weapon | E12: Marksman | F12: Sniper | G12: Marksman | H12: Infused Shot | I12: Ranged Attack, 3 SP: Make a basic Ranged Attack against one target. Does 125% damage and causes {Element Effect 1} on a hit; does no damage on a miss. | J12: Primary List | K12: Marksman | L12: Blaster | M12: Marksman | N12: Weapon Shot | O12: Ranged Attack, 6 SP: Make a basic Ranged Attack against one target. Does 50% damage on a hit, the target loses 3 Offense, and the target is Disarmed for 2 rounds; does no damage on a miss. | P12: Weapon | R12: Time | T12: Light | U12: Shaman
A13: Mechanic | B13: Craft Shackler | C13: Summon, 3 SP: Summon a Shackler Drone Minion with a level equal to your total level. It appears in an adjacent walkable square of your choice, and lasts for the encounter. | D13: None | E13: Mechanic | F13: Conservation | G13: Mechanic | H13: Craft Strobe | I13: Summon, 4 SP: Summon a Strobe Drone Minion with a level equal to your total level. It appears in a flyable square at up to 5 range, and lasts for the encounter. | J13: None | K13: Mechanic | L13: Brawn | M13: Mechanic | N13: Reassemble | O13: Self Boost, 7 SP: You must have at least one Minion to use this power. Choose one of your Minions; it is destroyed, and all allies within 3 squares of the Minion gain 4 Defense and 4 Evasion. | P13: Earth | R13: Water | T13: Space | U13: Occult
A14: Noble | B14: Diplomacy | C14: Talk Drain, 2 SP: Reduce one target's Offense by 3. | D14: None | E14: Noble | F14: Leadership | G14: Noble | H14: Politics | I14: Talk Boost, 4 SP: Offense and Defense penalties allies cause against enemies this round are increased by 1. Offense and Defense penalties enemies cause against your party this round are lessened by 1, to a minimum of 0. | J14: None | K14: Noble | L14: Helpful | M14: Noble | N14: Bold Leadership | O14: Talk Boost, 6 SP: All allies gain 1 Offense and the Emboldened boon; Offense and Defense penalties enemies cause against characters with this boon are lessened by 1, to a minimum of 0. The Emboldened boon lasts 4 rounds. | P14: None | T14: Time | U14: Occult
A15: Occultist | B15: Tearing Wrath | C15: Magic Attack, 3 SP: Range 10. Does 175% (persistent) damage on a hit; you take 50% of your basic Magic Attack's damage and gain 1 Offense on a miss. | D15: Kinetic | E15: Occultist | F15: Wrath | G15: Occultist | H15: Occult Magic | I15: Magic Attack, 5 SP: Range 10, Burst Area 3. Does 125% damage (persistent) and causes {Element Effect 3} on a hit; you take 25% of your basic Magic Attack's damage on a miss. | J15: Occult List | K15: Occultist | L15: Meticulous | M15: Occultist | N15: Forbidden Lore | O15: Magic Attack, 7 SP: Range 10, Burst Area 3. Does 175% damage and causes {Element Effect 2} on a hit; you take 75% of your basic Magic Attack's damage and gain 1 Offense on a miss. | P15: Primary List | T15: Water | U15: Shaman
A16: Pilot | B16: Distant Barrage | C16: Ranged Attack, 3 SP: Range 10, Burst Area 3. Has an additional 50% miss chance after a hit would be confirmed. Does normal damage on a hit; does 50% damage on a miss. | D16: Fire | E16: Pilot | F16: Magnitude | G16: Pilot | H16: Supply Drop | I16: Ranged Boost, 3 SP: Range 10, Burst Area 4. Restores 3 SP to all allies in the area. | J16: Space | K16: Pilot | L16: Unpredictable | M16: Pilot | N16: Exhaust Vent | O16: Zone Hazard, 7 SP: You create a visible Bombardment zone in a Burst Area 5 at up to 20 range. Enemies lose 5 Offense while they stay inside the zone. The zone lasts for 2 rounds. | P16: Air
A17: Scout | B17: Spike Trap | C17: Zone Hazard, 2 SP: You create a trap in a walkable square at 5 range. Any enemy who stops on an adjacent square suffers a basic Ranged Attack, as if by you with a Javelin, doing 150% damage on a hit. After attacking, the trap is destroyed. | D17: Piercing | E17: Scout | F17: Mysterious | G17: Scout | H17: Snare Trap | I17: Zone Hazard, 3 SP: You create a trap in a walkable square at up to 5 range. Any enemy who stops on an adjacent square loses 1 Offense, 1 Defense, and is Immobilized for 3 rounds. After doing this, the trap is destroyed. | J17: Blunt | K17: Scout | L17: Sniper | M17: Scout | N17: Double Trap | O17: Zone Hazard, 6 SP: You create 2 traps in different walkable squares at 5 range. Any enemy who stops on an adjacent square suffers a basic Ranged Attack, as if by you with a Javelin, that does 125% damage on a hit. After attacking, the trap is destroyed. | P17: Piercing
A18: Seer | B18: Rapid Research | C18: Talk Drain, 1 SP: Designate one enemy as your Subject. Evasion, Offense and Defense penalties you cause on your Subject are worsened by 1. The Subject ailment lasts for the encounter or until you use Rapid Research again. | D18: Time | E18: Seer | F18: Analysis | G18: Seer | H18: See Weakness | I18: Talk Drain, 3 SP: You must have a Subject to use this power. Your Subject loses 1 Offense, 2 Defense, and 1 Evasion, and any type weaknesses he has are revealed. | J18: None | K18: Seer | L18: Wisdom | M18: Seer | N18: Spatial Clarity | O18: Talk Boost, 7 SP: One ally gains 5 Evasion, 1 Defense and the Hawkeye boon; this boon doubles his ranged weapons' ranges, and all skills he knows with a specified range greater than 1 double that range. The Hawkeye boon lasts 3 rounds. | P18: Space
A19: Shaman | B19: Wither Soul | C19: Magic Attack, 3 SP: Range 10. Does 125% damage (persistent) and the target loses 3 SP on a hit; the target loses 1 SP on a miss. | D19: Water | E19: Shaman | F19: Terrify | G19: Shaman | H19: Shaman Magic | I19: Magic Attack, 5 SP: Range 10. Accuracy is based on Toughness instead of Expertise. Does 50% damage and causes {Element Effect 4} on a hit; causes {Element Effect 2} on a miss. | J19: Shaman List | K19: Shaman | L19: Devotion | M19: Shaman | N19: Cursed Spirits | O19: Magic Attack, 7 SP: Range 10. Accuracy is based on Toughness instead of Expertise. Does 150% damage (persistent) and the target loses 1 Offense on a hit; the target loses 1 Offense on a miss. | P19: Darkness
A20: Skirmisher | B20: Lightning Strike | C20: Ranged Attack, 2 SP: Make a basic Ranged Attack against one target. The target's Reaction abilities are never triggered by this attack. Does 125% damage on a hit; does no damage on a miss. | D20: Electric | E20: Skirmisher | F20: Mobility | G20: Skirmisher | H20: Tornado Shot | I20: Ranged Attack, 4 SP: Burst Area 2. Does normal damage on a hit; does 50% damage on a miss. | J20: Air | K20: Skirmisher | L20: Ambusher | M20: Skirmisher | N20: Blitz | O20: Ranged Attack, 2 SP: Make a basic Ranged Attack against one target. Does 75% damage, the cost of Blitz doubles this turn, you move up to 4 squares and you use Blitz again (if you have enough SP and there is a viable enemy target) on a hit; does no damage on a miss. | P20: Kinetic
A21: Thief | B21: Untouchable | C21: Self Boost, 1 SP: You gain 2 Evasion. You are visibly Preparing for 1 round. If no enemies damage you before your next turn, all allies gain 1 Defense. | D21: None | E21: Thief | F21: Unpredictable | G21: Thief | H21: Fight Dirty | I21: Melee Attack, 3 SP: Make a basic Melee attack against one target. Does 75% damage and reduces the target's Offense by 2 on a hit; does no damage on a miss. | J21: Darkness | K21: Thief | L21: Dodge | M21: Thief | N21: Acrobatics | O21: Self Boost, 5 SP: You gain 4 Evasion. If no enemies damage you before your next turn, all enemies lose 2 Defense. | P21: None
A22: Trickster | B22: Charlatan | C22: Talk Drain, 2 SP: Designate one enemy as your Mark. Your Mark has a 50% miss chance after a hit with any Attack would be confirmed against any of your allies. The Mark ailment lasts 3 rounds. | D22: None | E22: Trickster | F22: Nefarious | G22: Trickster | H22: Enrage | I22: Talk Drain, 3 SP: You must have at least one Mark to use this power. All enemies who are your Mark lose 3 Defense and 2 SP, but gain 1 Offense. | J22: Fire | K22: Trickster | L22: Mobility | M22: Trickster | N22: Fog Of War | O22: Talk Drain, 6 SP: All enemies lose 2 Offense and suffer the Befuddled ailment; this ailment halves their ranged weapons' ranges (minimum 1), and all skills they know with a specified range greater than 1 halve that range. The Befuddled ailment lasts 3 rounds. | P22: None
A23: Trooper | B23: Ground Pound | C23: Ranged Attack, 3 SP: Range 10, Burst Area 3. Accuracy is based on Expertise instead of Agility. Does 50% damage and reduces the target's Offense by 1 on a hit; does no damage on a miss. | D23: Earth | E23: Trooper | F23: Blaster | G23: Trooper | H23: Thunderbolt | I23: Ranged Attack, 5 SP: Line Area 10. Accuracy is based on Expertise instead of Agility. Does 150% damage on a hit; does no damage on a miss. | J23: Electric | K23: Trooper | L23: Magnitude | M23: Trooper | N23: Hellfire Bomb | O23: Ranged Attack, 7 SP: Range 10, Burst Area 3. Accuracy is based on Expertise instead of Agility. Does 150% damage (persistent) on a hit; does 50% damage (persistent) on a miss. | P23: Fire
A24: Wanderer | B24: Howling Wind | C24: Magic Attack, 3 SP: Range 10. Does 75% damage, reduces the target's Offense by 1, and pushes the target 3 squares on a hit; pushes the target 1 square on a miss. | D24: Air | E24: Wanderer | F24: Dodge | G24: Wanderer | H24: Rolling Wave | I24: Magic Attack, 5 SP: Range 5, Burst Area 3. Does normal damage, reduces the target's Offense by 1, and pushes the target 2 squares on a hit; pushes the target 2 squares on a miss. | J24: Water | K24: Wanderer | L24: Warded | M24: Wanderer | N24: Fearsome Storm | O24: Zone Hazard, 7 SP: You create a visible zone in a Burst Area 5 at up to 10 range. Any enemy who enters the zone from outside suffers a basic Magic Attack, as if from you, that does 150% damage and the target loses 1 Offense on a hit. The zone lasts for 3 rounds. | P24: Electric
A25: Worldweaver | B25: Black Starfield | C25: Zone Hazard, 3 SP: You create a visible zone in a Burst Area 4 at up to 10 range. Any enemy who enters the zone from outside suffers a basic Magic Attack, as if from you. The zone lasts for 3 rounds. | D25: Space | E25: Worldweaver | F25: Meticulous | G25: Worldweaver | H25: Accelerate | I25: Zone Boost, 5 SP: You create a visible zone in a Burst Area 5 at up to 10 range. Allies gain 6 Evasion while they stay inside the zone. The zone lasts for 3 rounds. | J25: Time | K25: Worldweaver | L25: Energized | M25: Worldweaver | N25: Infusion | O25: Zone Boost, 7 SP: You create a visible zone in a Burst Area 5 at up to 10 range. Allies gain {Element Affinity 3} while they stay inside the zone. Any enemy who enters the zone from outside suffers a basic Magic Attack as if from you. The zone lasts for 3 rounds. | P25: Primary List
A26: Cerpali | B26: Pincer Grab | C26: Melee Attack, 0 SP: Make a Melee Attack with your Claws against one target. Does 75% damage and the target is Immobilized for 1 round on a hit; does no damage on a miss. | D26: Blunt | E26: Cerpali | F26: Parry | G26: Cerpali | H26: Pincer Block | I26: Melee Attack, 1 SP: Make a basic Melee Attack wih your Claws against one target. Does 75% damage and you gain 1 Defense on a hit; does no damage on a miss. | J26: Blunt | K26: Cerpali | L26: Alertness | M26: Cerpali | N26: Pincer Flurry | O26: Melee Attack, 4 SP: Make 4 Melee Attacks with your Claws against one target. An attack does 50% damage on a hit; it does no damage on a miss. If the target dies, remaining attacks target a random adjacent enemy. | P26: Blunt
A27: Eidolon | B27: Essence Bolt | C27: Basic Magic Attack, 0 SP: Range 10. Does 75% damage and causes {Element Effect 1} on a hit; does no damage on a miss. | D27: Primary Fixed | E27: Eidolon | F27: Finesse | G27: Eidolon | H27: Essence Shield | I27: Self Boost, 2 SP: You gain 2 Defense and 2 Evasion. | J27: Primary Fixed | K27: Eidolon | L27: Energized | M27: Eidolon | N27: Essence Blast | O27: Magic Attack, 5 SP: Range 10, Burst Area 3. Does normal damage and causes {Element Effect 2} on a hit; causes {Element Effect 1} on a miss. | P27: Primary Fixed
A28: Erezdo | B28: Armor Pound | C28: Melee Attack, 0 SP: Make a Melee Attack with your Slam against one target. Does 75% damage and the target loses 2 SP on a hit; does no damage on a miss. | D28: Blunt | E28: Erezdo | F28: Resist | G28: Erezdo | H28: Hurl Saintstone | I28: Ranged Attack, 2 SP: Range 5, does not use a Weapon. Does 150% damage and pushes the target 2 squares on a hit; does no damage on a miss. | J28: Earth | K28: Erezdo | L28: Devotion | M28: Erezdo | N28: Saintstone Crush | O28: Melee Attack, 4 SP: Make a Melee Attack with your Slam against one target. Does 150% damage and the target loses 1 Offense on a hit; does no damage on a miss. | P28: Earth
A29: Glarosp | B29: Venomous Maw | C29: Melee Attack, 0 SP: Make a Melee Attack with your Bite against one target. Does 150% damage (persistent) and you lose 1 Defense on a hit; does no damage on a miss. | D29: Water | E29: Glarosp | F29: Terrify | G29: Glarosp | H29: Blade Dance | I29: Melee Attack, 2 SP: Make 2 Melee Attacks with your Talons against one target. An attack does 75% damage on a hit; it does no damage on a miss. If the target dies, remaining attacks target a random adjacent enemy. | J29: Slashing | K29: Glarosp | L29: Finesse | M29: Glarosp | N29: Abandonment | O29: Talk Drain, 5 SP: Designate one enemy as Isolated. An Isolated enemy causes any Talk Boost that targets him to automatically fail (the failure doesn't affect any other targets). The Isolated ailment lasts 2 rounds. | P29: Darkness
A30: Human | B30: Psychomatic Drop | C30: Basic Magic Attack, 0 SP: Range 0, Burst Area 3. Gives you the Datapush boon, which lets you deal physical damage based on Expertise instead of Toughness and lasts for the encounter. Does 50% damage on a hit; does no damage on a miss. | D30: Kinetic | E30: Human | F30: Unpredictable | G30: Human | H30: Data Weight | I30: Zone Hazard, 2 SP: You must have the Datapush boon to use this power. You create a visible Weight zone in a Burst Area 5 centered on you. Enemies lose 2 Offense and 2 Evasion while they stay inside the zone. The zone lasts for 3 rounds. | J30: Kinetic | K30: Human | L30: Analysis | M30: Human | N30: Psyche Force | O30: Self Boost, 5 SP: You must have the Datapush boon to use this power. You gain 5 Offense. | P30: Kinetic
A31: Ilapa | B31: Stabbing Kick | C31: Melee Attack, 0 SP: Make a Melee Attack with your Talons against one target. Does 75% damage and pushes the target 1 square on a hit; pushes the target 1 square on a miss. | D31: Piercing | E31: Ilapa | F31: Leadership | G31: Ilapa | H31: False Bullseye | I31: Talk Boost, 2 SP: Designate one ally as Obvious; that ally loses 1 Evasion. If an enemy hits the Obvious ally before your next turn, the ally loses the Obvious ailment and all allies gain 3 Offense. The Obvious ailment lasts 1 round. | J31: None | K31: Ilapa | L31: Helpful | M31: Ilapa | N31: Mass Calm | O31: Magic Attack, 5 SP: Range 10, Burst Area 4. Does no damage and the target loses 2 Offense on a hit; the target loses 1 Offense on a miss. | P31: None
A32: Kurguiv | B32: Slicing Beak | C32: Melee Attack, 0 SP: Make a Melee Attack with your Bite against one target. Does 75% damage on a hit, with damage based on Agility instead of Toughness; does no damage on a miss. | D32: Slashing | E32: Kurguiv | F32: Mobility | G32: Kurguiv | H32: Flying Charge | I32: Melee Attack, 2 SP: Move your speed and end adjacent to an enemy. Make a basic Melee Attack against one target. Does 75% damage on a hit, with damage based on Agility instead of Toughness; does no damage on a miss. | J32: Air | K32: Kurguiv | L32: Leadership | M32: Kurguiv | N32: Rushing Tackle | O32: Melee Attack, 4 SP: Move your speed and end adjacent to an enemy. Make a basic Melee Attack with your Slam against one target. Does 125% damage on a hit and pushes the target 2 squares on a hit; does no damage on a miss. | P32: Time
A33: Lomuk | B33: Sudden Bite | C33: Melee Attack, 0 SP: Make a Melee Attack with your Bite against one target. The target's Reaction abilities are never triggered by this attack. Does 75% damage on a hit; does no damage on a miss. | D33: Blunt | E33: Lomuk | F33: Dexterity | G33: Lomuk | H33: Alter Distance | I33: Ranged Drain, 2 SP: Range 10. Designate one enemy as your Prey. Your Prey can be targeted by you as if he is adjacent, regardless of his actual position. The Prey ailment lasts 4 rounds or until you use Alter Distance again. | J33: Space | K33: Lomuk | L33: Mobility | M33: Lomuk | N33: Far From Harm | O33: Zone Hazard, 4 SP: You create a visible Distortion zone in a Burst Area 5 centered on you. Enemies lose 3 Offense while they stay inside the zone. The zone lasts for 3 rounds. | P33: Space
A34: Nodebpe | B34: Massive Impact | C34: Melee Attack, 0 SP: Make a Melee Attack with your Slam against one target. Does 75% damage on a hit; does 25% damage on a miss. | D34: Blunt | E34: Nodebpe | F34: Brawn | G34: Nodebpe | H34: Quake Stomp | I34: Basic Magic Attack, 3 SP: Range 0, Burst Area 5. Accuracy is based on Toughness instead of Expertise. Does 75% damage on a hit; does 25% damage on a miss. | J34: Earth | K34: Nodebpe | L34: Warded | M34: Nodebpe | N34: Body And Mind | O34: Self Boost, 5 SP: You gain 2 Offense, 2 Defense, and the Channeling boon, which lets you base physical accuracy on Persona instead of Agility and lasts for the encounter. | P34: None
A35: Pelmir | B35: Flechette Seeds | C35: Basic Magic Attack, 0 SP: Range 5. Does normal damage on a hit; does 25% damage on a miss. | D35: Slashing | E35: Pelmir | F35: Wrath | G35: Pelmir | H35: Binding Vine | I35: Magic Attack, 3 SP: Range 5. Does normal damage and the target is Immobilized (Stage 2) for 2 rounds on a hit; does no damage on a miss. | J35: Blunt | K35: Pelmir | L35: Wrath | M35: Pelmir | N35: Acid Fruit | O35: Zone Hazard, 4 SP: You create a trap in a walkable square at up to 5 range. Any enemy who stops on an adjacent square suffers a basic Magic Attack as if by you, doing 200% damage (persistent) on a hit. After attacking, the trap is destroyed. | P35: Water
A36: Robot | B36: Computed Smash | C36: Melee Attack, 0 SP: Make a Melee Attack with your Slam against one target. Accuracy is based on Expertise instead of Agility. Does 75% damage on a hit; does no damage on a miss. | D36: Blunt | E36: Robot | F36: Analysis | G36: Robot | H36: Lock On | I36: Ranged Drain, 1 SP: Range 20. Reduce one target's Evasion by 2 and Defense by 1. | J36: None | K36: Robot | L36: Resist | M36: Robot | N36: Bombarding Pod | O36: Zone Hazard, 5 SP: You create a visible zone in a Burst Area 5 at up to 20 range. Any enemy who enters the zone from outside suffers a basic Ranged Attack as if from you, doing 125% damage on a hit. The zone lasts for 2 rounds. | P36: Atomic
A37: Sfyst | B37: Trunk Grab | C37: Melee Attack, 0 SP: Make a Melee Attack with your Slam against one target. Accuracy is based on Expertise instead of Agility. Does 50% damage and the target is Immobilized for 1 round on a hit; does no damage on a miss. | D37: Blunt | E37: Sfyst | F37: Alertness | G37: Sfyst | H37: Super Senses | I37: Ranged Drain, 2 SP: Range 20. Reduce one target's Evasion by 4 and any type weaknesses he has are revealed. | J37: None | K37: Sfyst | L37: Wisdom | M37: Sfyst | N37: Ready For War | O37: Talk Boost, 5 SP: All allies gain 2 Offense and 3 Evasion. | P37: None
A38: Tassar | B38: Glitch Caress | C38: Melee Drain, 0 SP: The target is Malfunctioning for 4 rounds. | D38: Electric | E38: Tassar | F38: Dodge | G38: Tassar | H38: Disabling Order | I38: Magic Drain, 2 SP: The target is Jammed (Stage 2) for 3 rounds. | J38: Electric | K38: Tassar | L38: Nefarious | M38: Tassar | N38: Monologue Taunt | O38: Talk Boost, 5 SP: Reduce your Evasion by 1. All allies gain 4 Offense. | P38: None
A39: Uljir | B39: Barbed Shear | C39: Melee Attack, 0 SP: Make a Melee Attack with your Slam against one target. Does 50% damage and reduces the target's Defense by 1 on a hit; does no damage on a miss. | D39: Slashing | E39: Uljir | F39: Mysterious | G39: Uljir | H39: Scathe | I39: Melee Attack, 2 SP: Make a Melee Attack with your Slam against one target. Does normal damage (persistent) and the target loses 1 Offense on a hit; does no damage on a miss. | J39: Slashing | K39: Uljir | L39: Dexterity | M39: Uljir | N39: Mad Muttering | O39: Talk Drain, 3 SP: All enemies lose 1 Offense. You are visibly Preparing for 1 round. If you lose no more than a quarter of your current HP by your next turn, all enemies lose 2 Defense. | P39: None
A40: Vashk | B40: Furious Assault | C40: Melee Attack, 0 SP: Make 4 Melee Attacks, picked randomly from available body weapons, against one target. An attack does 25% damage on a hit; it does no damage on a miss. If the target dies, remaining attacks target a random adjacent enemy. | D40: Weapon | E40: Vashk | F40: Violence | G40: Vashk | H40: Sudden Growth | I40: Self Boost, 2 SP: You recover 30% of your max HP and gain 1 Offense. | J40: None | K40: Vashk | L40: Brute | M40: Vashk | N40: Ripping Talons | O40: Melee Attack, 3 SP: Make a Melee Attack with your Talons against one target. Does 150% damage (persistent) and reduces the target's Evasion by 1 on a hit; does no damage on a miss. | P40: Piercing
F42: Alertness | J42: Alertness | L42: Alertness
F43: Ambusher | J43: Ambusher | L43: Ambusher
F44: Analysis | J44: Analysis | L44: Analysis
F45: Blaster | J45: Blaster | L45: Blaster
F46: Brawn | J46: Brawn | L46: Brawn
F47: Brute | J47: Conservation | L47: Brute
F48: Conservation | J48: Dodge | L48: Conservation
F49: Devotion | J49: Energized | L49: Devotion
F50: Dodge | J50: Helpful | L50: Dodge
F51: Energized | J51: Leadership | L51: Energized
F52: Dexterity | J52: Magnitude | L52: Dexterity
F53: Finesse | J53: Meticulous | L53: Finesse
F54: Helpful | J54: Nefarious | L54: Helpful
F55: Leadership | J55: Parry | L55: Leadership
F56: Magnitude | J56: Resist | L56: Magnitude
F57: Meticulous | J57: Sniper | L57: Meticulous
F58: Mobility | J58: Unpredictable | L58: Mobility
F59: Mysterious | J59: Violence | L59: Mysterious
F60: Nefarious | J60: Warded | L60: Nefarious
F61: Parry | J61: Wisdom | L61: Parry
F62: Resist | L62: Resist
F63: Sniper | L63: Sniper
F64: Terrify | L64: Terrify
F65: Unpredictable | L65: Unpredictable
F66: Violence | L66: Violence
F67: Warded | L67: Warded
F68: Wisdom | L68: Wisdom
F69: Wrath | L69: Wrath

Sheet: Traits
A1: Trait | B1: Trait Effects
A2: Alertness | B2: Reduces accuracy of all attacks against you in the first round by 50%.
A3: Ambusher | B3: You deal 50% more damage on your attacks in the first round.
A4: Analysis | B4: Defense penalties you cause with Outwit are increased by 1.
A5: Blaster | B5: You deal 35% more damage with Ranged Attacks.
A6: Brawn | B6: You gain 20% more max HP.
A7: Brute | B7: You deal 35% more damage with Melee Attacks.
A8: Conservation | B8: The SP costs of all of your Skills are decreased by 15% (round down).
A9: Devotion | B9: Offense penalties you receive from Intimidate are decreased by 2, to a minimum of 0.
A10: Dexterity | B10: You gain 35% more accuracy with Melee Attacks.
A11: Dodge | B11: The accuracy of all attacks against you is reducd by 25%.
A12: Energized | B12: You gain 25% more Surge.
A13: Finesse | B13: You gain 25% more accuracy with all Attacks.
A14: Helpful | B14: The SP costs of your Boost Skills are decreased by 25% (round down).
A15: Leadership | B15: Offense bonuses you grant with Inspire are increased by 1.
A16: Magnitude | B16: The SP costs of your Skills with an Area are decreased by 25% (round down).
A17: Meticulous | B17: You gain 35% more accuracy with Magic Attacks.
A18: Mobility | B18: Against Ranged Attacks, your Soak increases by 25%, and the accuracy of those attacks is reduced by 25%.
A19: Mysterious | B19: Offense and Defense penalties you receive from Outwit and Intimidate are decreased by 1, to a minimum of 0.
A20: Nefarious | B20: The SP costs of your Drain Skills are decreased by 25% (round down).
A21: Parry | B21: Against Melee Attacks, your Soak increases by 25%, and the accuracy of those attacks is reduced by 25%.
A22: Resist | B22: Your Soak increases by 25%.
A23: Sniper | B23: You gain 35% accuracy with Ranged Attacks.
A24: Terrify | B24: Offense penalties you cause with Intimidate are increased by 1.
A25: Unpredictable | B25: Defense penalties you receive from Outwit are decreased by 2, to a minimum of 0.
A26: Violence | B26: You deal 25% more damage with all attacks.
A27: Warded | B27: Against Magic Attacks, your Barrier increases by 25%, and the accuracy of those attacks is reduced by 25%.
A28: Wisdom | B28: Defense bonuses you grant with Advise are increased by 1.
A29: Wrath | B29: You deal 35% more damage with Magic Attacks.